,Subreddit,Title_Content
182,0,Men who were once selfish narcissistic etc   what made you want to change Seems like every so often I come across someone remarking how they were once selfish narcissist etc  and had a life experience that made them reconsider how they held themselves  What was yours  Was it a relationship  a job  an event  or something more gradual     amp  x   B   Edit  Follow up   how did you change 
183,0,How would you feel if you found out your SO had been making you wear condoms even though she was on birth control This happened to me recently  My girlfriend hid the fact that she was on birth control for over   months because she didn t want me to stop wearing condoms  Getting pregnant is one of her biggest fears  and I understand that so I m not gonna ask her to let me stop wearing condoms  but I m still a little bummed about it lol  Part of me is relieved that it s next to impossible for her to get pregnant though 
184,0,What s the worst  first world problem  you ve ever encounterednan
185,0,How much water do you guys drink per day I m a big water fan  so I usually put down about         oz a day   Was reading around and found out that most people drink much  much  much less than this   I ve seen   pieces of advice      One saying     oz glasses     oz   but that seems insanely low     Another saying half your weight in lbs but oz  I was also reading about water intoxication if you have more than your kidneys can process   
186,0,When was the last time the words  These dumb motherfu  amp ers  came outta your mouth or crossed your mind  And  why This happens almost all day  everyday to me    is it me or what  The last time was just before this post as I went to plug an electrical cord into the wall sockets but of course due to there being one in there already the second didn t fit  Ugh  these dumb mofos  And  I m not talking about two oddly shaped plugs  both were very standard plugs  If the manufacturer would spaced them a ball hair more then no problemo but   
187,0,What is the most ridiculous thing you have done to keep focused pass time in class I personally like to figure out how they lecture and pick it a part like  how many times will this prof use a mildly offensive accent     My current favourite is  how many times will this prof say  uhm  or uh  so far this whole semester he has never been under x   
188,0,When did you start to feel that you could  no longer relate  to your parents By this I dont mean you didnt like them  but rather when did that strong bond feel like it was lessening  when you felt they or you could no longer relate to each other  This is often the case during the early teenage years  Or perhaps that was not the case with you  If it was  when did it start and how bad did it get  Did it improve years later  Would like to hear the different stories     amp  x   B 
189,0,How can I help a friend dealing with their potentially abusive partner In my class  m     there s a girl  A   I ve been good friends with for years   For   years she s been with another guy in my class  The last few weeks she s been telling me about their relationship problems and how bad he makes her feel  So two days ago we talked for over an hour  A is completely crushed and it hurts me to see her like that   After our talking I got the hunch he might be emotionally abusing her   Whenever both are in the same room  A wants to talk to him  have his attention  but he is extremly distant and just does not ever talk to her  She showed me texts  where she asked him whats up and why he doesn t wanna talk to her  for A doesnt want to argue in front of others  And her boyfriend just straight up insults her  telling her to shut up   One thing that really concerns me ist that she told me that her boyfriend hit her   About two times   And  he is a very distanced calm guy  that he would often get really really angry with her and have a blast and when she cries he shouts at her to shut up   Now I don t want this girl to be so unhappy so I ve been there for her the last few days  Her boyfriend got wind of that and now probably nows A told me some things   Whitch he of course does not like at all   What goves me a bad feeling however is that I am now cought up in their relationship issues and I dont mean to intrude things that are no business of mine  Which is actually pretty hard because when A is deavastated and asks me for help  I got to do something  Im just unsure how far I have the right to jugde their relationship   I just don t think that it will get any better  because her boyfriend absolutely refuses to talk about their issues and gets angry when she wants to talk about it  Also I m afraid he might hit her again  And I cant stand whatching her being so crushed by him  for she means a lot to me   Thank you for reading this far  Sorry for the long text  I would be really thankful for any good advice  
190,0,Men that look younger than you are  how did that affect your dating life I literally look like a   yo while being   yo and this doesn t help with dating because women seem to generally avoid dating younger men  and I just feel somewhat of a creep if I was to approach a woman    years younger than me 
191,0,How to be a more  words  man My girlfriend and I are struggling with an aspect of our relationship  She doesn t feel complimented enough basically  Not enough  you re beautiful s    This didn t take me by any surprise  as I ve heard it from previous relationships as well  I don t have any problem using babe or pet names  It s easy to say I love you  or I miss you  Yet the midday texts she s looking for  her examples   I saw your post and you look beautiful today   or  I love when your hair is like that   are hard for me   I want to accept that this is a personal shortcoming  Now how do I improve this aspect of myself 
192,0,Are you  fast and rough  OR  slow and passionate   What do you think girls like nan
193,0,When it comes to online dating  how do you avoid coming off too goody two shoes or soft i m just not the alpha type  and i m not a r niceguys either  i am not owed anything from a girl because i am being kind  i more so just think i come off as uninteresting or way too soft for the girls i find attractive  i ve been out of a relationship for about two years now and my conversations are just so g rated it s like i can t think when chatting with a girl i find attractive  twice now they have unmatched and i just smh at myself like what am i even saying lol  trying to just keep it playful but some girls only give one word or short phrase replies  my dumb ass brother is the opposite of me and chats up a hundred girls at once and his advice just doesn t work for me  it s like im not acting like myself and it s clear  
194,0,Guys who smoke up often  what was your  rock bottom  moment My rock bottom moment was when I dumped hydrochloric acid on a counter during school  in the middle of a chemistry experiment  It melted the top of the table and I looked like an idiot 
195,0,What s a small annoyance you face while peeing  and what techniques do you employ to overcome it nan
196,0,Why is there such a bad rep when a man likes fruity drinks  ciders compared to beer I HATE the taste of beer  but really enjoy things like Mikes Hard Lemonade  Smirnoff or Jack Daniels drinks like Lynchburg Lemonades  I also prefer to drink vodka cranberries more than I do whiskey  But according to a few people I know    those are woman drinks  
197,0,How common is it for a person to drive with both feet I mention this because my grandpap says that he drives with both  One for the gas and one for the brake  I find it weird because unless you re driving a manual  there s no need to use both  He said my grandma did the same  So I suppose it could be a generational thing   
198,0,How does it feel to have a friend like you romantically nan
199,0,What did you study after high school and where has it placed you in life Finishing off high school this year and I m torn between a few courses  Would be happy to hear what everyone s experience was like choosing and if it paid off 
200,0,What is a life changing product you purchased or received that you couldnt believe you went without for this long nan
201,0,Who do you go to when you are feeling emotionally but dont have a family Its hard to be vulnerable and I find most people are off put when you express true feeling of emotional instability  I dont have a family I m comfortable consoling in and a therapist seems excessive  Im not religious so a pastor doesn t make sense to me     
202,0,How do you act around your friend who asked to to see you  who you haven t seen for sometime and in that time has become financially successful nan
203,0,What movies do you feel should have been rated R Whether the content pushed the boundaries of the rating it currently had or the movie pulled punches due to its rating  please name the reason why you feel the movie should be have been rated differently  
204,0,How do you even know when to make a move skinship eg holding hands  on the woman you are dating without the fear of overstepping your boundaries nan
205,0,To the working men of reddit  are you working   part time jobs at once have you ever  if so what was it like  is it worth it nan
206,0,How do you all feel about dreads I m partially just asking out of curiosity but mostly want to know what I d have to accept if I got em   do most people feel they are messy in a negative way or are they ever a nice aesthetic  Would they deter from a woman and take away from her beauty of her hair wasn t shiny and smooth 
207,0,What are small things you can do to make yourself happier when you live and happy life I already work out  try to eat healthy  play games  Lack of friends  a woman and a good job takes its toll but I don t have control over those what other things can I do that are simple but will make me less unhappy 
208,0,How much allowance do you think a teen should get per week I ve seen some strong opinions about this  I get    a week which is    less than my sister used to get  What do you guys think 
209,0,What are some things about your past relationships that made you love your partner even more nan
210,0,What are the coolest things a teen can or should do before he s    nan
211,0,If you were an ancient god  what would be a ritual to summon you nan
212,0,How intensely do you feel attraction to women in real life So maybe I m a  late bloomer  or something  but I ve only recently found myself  early    s  feeling physically attracted to men in real life  When I was a teenager I only had crushes on celebrities and fictional characters    I feel quite overwhelmed by a man I m acquaintances with  I don t want to date this man because I m not attracted to his personality  only his body  But it s just    wow  When I m with him I have to tell myself  don t look at his arms   make normal eye contact   listen to his  words  not just the sound of his voice       I guess I m used to the jokes about men trying not to look at women s cleavages and I m used to my female friends discussing what outfits are  appropriate  or not for certain events if they do don t want male attention  I m also used to guys being a lot more open talking about sex and who they find attractive at a younger age  My friends and I used to roll our eyes in high school because we just didn t feel any of those feelings    But I d always looked at men the same way I looked at other women so I don t think I ever understood what it meant when other people felt  attraction   I could tell  yes that man is handsome  etc but I wouldn t behave any differently around him  And as naive as it sounds  I didn t understand why going running in a tank top would make men behave differently or more likely to talk to me  I just thought   it s my boring body and I don t see anything sexual about it  Are these guys just being silly and playful teasing out of choice  Because it s fun to flirt   But I guess now I m starting to realise  The way I feel about this particular guy in my life when I see him shirtless is maybe how men feel about some other women and maybe even me   Considering the average male has a higher sex drive than the average woman  I suppose I m wondering how intense this feels for men  because it s leaving me in a bit of a frazzle  Let s say you re playing soccer with a girl who has an attractive body  What difference does it make what she wears  I mean  on a scale from naked to wearing a full tracksuit when does she start appearing distractingly attractive  Does this attraction disappear a bit if you are friends  Do you naturally start to ignore the attraction or is it something you actively try to decrease    TLDR  I think a dude is smoking hot and it s so intense  It got me wondering how intense other people have felt attraction to people they were not currently dating and how they deal with it     amp  x   B    amp  x   B 
213,0,Whats it like having a brother I was raised with   sisters  Yes  my parents had   kids and I was the only boy  I have really close  friends that I think of brothers and brother in law s but I don t really have a blood brother   EDIT  Thanks for the awesome responses everyone
214,0,When does frugal cross the line into cheapskate nan
215,0,What is the worst thing you ever seen in your lifetime nan
216,0,What was your best  Hold my beer  moment nan
217,0,What s the most ridiculous hilarious threat that the friends of a girl you started dating being in a relationship with has said to you Personally I ve been told I ll get my head ripped off by her best friend if I hurt her  they know where I live and a bunch of others but I m sure there are some crazy ones out there   Doesn t even have to be a threat  just anything funny or strange 
218,0,I was in the garage with my dad moving some boxes  I saw a dead mouse on the floor and screamed like a little bitch  When was a time you felt completely emasculated in front of your dad nan
219,0,What does your SO do to make you feel special nan
220,0,How do you cut the top part of your hair with clippers There are no videos of people cutting the top part of their hair with clippers on YouTube  They always use scissors 
221,0,Men Who Admitted Their Weird Kink to GF Wife Partner and They Didn t Share Your Feelings  What Happened nan
222,0,How do ya enjoying hanging out in a loud bar or club I ve always kinda wondered this  A few nights ago I was out with some friends at a bar when karaoke started  The music got louder and the bar got busier  My friends kept chatting away  As the drinks kept flowing the conversations turned lighter and weirder  But I m over here   can only catch maybe a quarter to half of all sentences  The subjects are kinda all over the place  ya know     drinks in kinda conversations   Anyway I start getting anxious cuz it s loud and everyone is yelling jibberish   and I have no fucking idea what anyone is talking about    How do you guys manage to enjoy these scenarios  I know the obvious answer is drink more and care less  But I find it hard to do sometimes  I prefer the chill atmosphere of a brewery than an obnoxiously loud bar  But my girl likes the obnoxiously loud bars and I gotta play along while I m out with her 
223,0,What items could you buy that would make the cashier the most uncomfortable nan
224,0,Hey guys  what podcasts have you been listening to nan
225,0,Have you ever had a dream which makes you sad after you wake up Fellas  have you ever had such a good dream where everything was coming up milhouse  only for you to wake up  and gain a feeling of instant depression because you came back to your ordinary life where all the thing s you ve dreampt about were gone  It s a first time feeling for me  and I just gotta know that somebody else has had this    amp  x   B   For example  in my dream  I met this awesome chick and we were having this lovely conversation  Before I could ask her to a date  well      amp  x   B   I may actually have depression now   Edit  WOW this blew up  From a small little distraction at school in the morning to over    k upvotes  Thanks so much to everyone who submited their stories  I ve read them all   Edit V   Now    k  and front page of r AskMen  I am beyond baffled that my little pitty love story started a place for a ton of other  much more sad stories to be shared    Final Edit  We exceeded   k upvotes and made it to     on r popular  Thanks to everyone who commented  upvoted  or even just read the post  I ve seen others do AMA s after their post blows up  and would be down to do one if there was a demand for it  Thanks again 
226,0,Men of Reddit  What are your home remedies for when you contract a cold Edit  I may or may not have a cold      Edit    I have a cold  but this is fine      Edit    THIS IS FINE   Edit    What s life   apparently whiskey is a thing 
227,0,Guys  what s the biggest dealbreaker even when you think you ve found the perfect person for you nan
228,0,How do you guys with sisters deal with their annoying Boyfriends Like seriously  I need some tips  I am getting so frustrated with my sisters current love interest  he is absolutely annoying    His laugh  the way he talks  He is a British person like me so its not a language barrier  but he is a southerner and I am a northerner  the way he walks  the way he acts    And I know this is going to sound horrible  but he eats really loudly  like he sucks the food dry or something whilst its in his mouth  its disgusting    Example  First time my sister brought him back to the house to meet the family  he walks around all arrogantly  sticking his chest out and doing what he wants    The reason I am so annoyed with him is because he think he is such a big man  he is arrogant because he thinks he can handle every situation   He is      probs about    kg and used to do some amateur fighting  terrible defense and his offense isnt great  saw one of his fighting videos and training videos  terrible form   Doesn t really work out or keep himself in good condition   I am          pounds  Around   kg   weight train very often  used to do Karate and Boxing    All I want to do is tell him to leave  I cant handle him  as soon as he walks through the door I get a massive burst of anger  the only reason he thinks we get along is because my mum and sister  My other sister  have been holding me back from saying something    And my sister that is with him is fully aware of my hatred and problems with him  but she doesn t try and help  he lives   mins away  but my sister insists on him staying over every night  he hasn t gone home for like   weeks  wtf   
229,0,What is your love language Maybe you re familiar with the   love language concepts  receiving gifts  words of affirmation  quality time  physical touch  and acts of service  Which is your favorite 
230,0,What makes a man seem desperate  Emotionally and or physicallynan
231,0,Guys who have trouble opening up  what helped you in your current or past relationships  and what struggles did you face in the relationship because of having your guard up so high Does it really just take time and patience on the girls part 
232,0,How has having an emotional unavailable or mentally ill mother affected your life and your relationship with women nan
233,0,Guys  how do you build attraction on first or second dates Or do you just let it happen if it happens 
234,0,How do you get the discipline to not go over your calorie limit when you are hungry and you are trying to lose weight nan
235,0,What red flags did you overlook that you realized now when you dated a girl you found attractiveor Are there any  red flags or things you deliberately overlooked because you found her hot  girlfriend or not 
236,0,What is the appeal in  barely legal  girls pornography nan
237,0,Have you had recurrent sexual fantasies  What were they about nan
238,0,How do you help your pregnant S O My girlfriend is getting to the later stages of her pregnancy and is uncomfortable majority of the time   How do you guys help your S O in this situation  
239,0,Have you been physically abused in a relationship with a woman  Did you tell anyone  If you didn t  why nan
240,0,Fellow Men of Reddit  What  drives  you  What is the thing that pushes you to be your best  Is it positive motivation or a negative one   spite  for example  nan
241,0,At what age what situation made you realize the importance of keeping your assets actions documented  I ve always been relatively good at keeping records  very bad at organizing them  and today i lost      because of that   i plan to  step up my game  this weekend by documenting and updating all my passwords  receipts  medical records  etc  I always new this was important but today having to buy something of great importance again  something that was completely avoidable and my fault  really was the final straw    amp  x   B   TL DR   lost a receipt for something important  lost a good amount of money  documenting everything important CLOSELY from now on  and having them in ONE PLACE neatly done  instead of scattered god knows where 
242,0,What could long distance friends do to enjoy each other s company Basically I have a friend that I met here on Reddit  We have been chatting for nearly   months  Problem is we don t have anything to talk about  What else other than chatting we could do    And don t mention multiplayer videogames  they don t like that 
243,0,What is it about the phrase  pal  or  buddy  that really riles up people I m just trying to denote that I m your pal  buddy 
244,0,What is a proper technique of wiping butt To balls or from balls  Does it depend on amount and liquidity of shit  How many fingers    Anything about your buttwiping technique
245,0,How does it make you feel when another guy is significantly more attractive than you are Do you get jealous and or intimidated  Are you less likely to befriend them because they re attractive  Or do you not really think about it  
246,0,What do you do when your GF dislikes your female bestie nan
247,0,How do you stop getting jealous nan
248,0,What are your go to icebreakers or topics to talk about with someone you d just met nan
249,0,What is one thing you can teach me today nan
250,0,For those who didnt get into a serious relationship until they were nearly     what difficulties struggles did you have with finally committing If any   
251,0,Why do lots of guys get violent in arguments when their mom s are insulted nan
252,0,Do you prefer be to in a relationship or single  why nan
253,0,When did you realize you were the toxic one in the relationship And what happened from there 
254,0,What have you bought on the internet you wish you hadn t without seeing it first nan
255,0,How did you get over an ex who left you for another person nan
256,0,How much actual work do you do in a day I guess this is mostly aimed at the poor souls who work an office job      but could apply to others too I m sure  I watched Office Space for the first time a few weeks ago  and was struck by the part where  Peter is talking about how much work he does in a week  https   www youtube com watch v zBfTrjPSShs   It got me wondering about how much real  actual work  I  do in a day  and I reckon it s probably sub   hours  So men  how much work do you actually do  
257,0,What is important in a father nan
258,0,Men of Reddit  how worried are you about getting a girl pregnant despite wearing a condom nan
259,0,What do you do when you get bored with your current job I ve been working full time corporate jobs now for about   years and have been with my current company almost a year    I work in sales and I m not really passionate about what I do or find the work very meaningful  but I like my company  my coworkers  and am generally a high performer in my role    I ve been getting bored for the last few months  I pretty much do the same things every day with little variation in the types of conversation I have with clients  There s no real problem solving aspect to my role that I can dig into  which is something that I d enjoy    I d rather not jump ship and leave but I know eventually this is going to eat away at me and I ll start to hate going to work  I don t want to let it get to that point    Just curious  has anyone ever told their boss  I m getting bored  what can I do here that will challenge me   Does this seem like a good idea  I know it s hard to give specific advice without knowing my situation company better  but general advice would be great  What do you do when you start getting bored of your job 
260,0,What book are you reading right now  A friend asked the other day what I was up to that evening     I told him I was going to read a book  he laughed   Blokes don t read books he said    So do you read books  if so what are you reading right now 
261,0,Those who chose to stay single  why did you do it and how d you end up nan
262,0,what is your so s behaviour like when she s on her period is she pretty much the same  or does she turn into a different person 
263,0,How fast is your digestive system I m just done taking a shit  at work ofcourse  and upon inspection saw a bunch of corn remnants floating around in the bowl  I ate corn yesterday evening  so I can deduce it took the corn about    hours to go from one end to the next  Knowing that the digestive tract is about    feet I now know the corn was going     feet per hour 
264,0,You are taking a dump in the public toilet  You flush and the toilet clogs and water overflows  You can hear someone waiting for an available cubicle  What are you going to do nan
265,0,Men in relationships  what differences did you observe in how other women percieved you nan
