,Subreddit,Title_Content
0,0,The AskMen Book Club   The Picture of Dorian Gray  Final Discussion Thread   March Book Announcement Hello and welcome to the final discussion thread for The Picture of Dorian Gray  You are free to post any thoughts  opinions or questions you have about the book   Voting for March s book has now finished and the winner is   The Trial   by Franz Kafka    gt A terrifying psychological trip into the life of one Joseph K   an ordinary man who wakes up one day to find himself accused of a crime he did not commit  a crime whose nature is never revealed to him  Once arrested  he is released  but must report to court on a regular basis   an event that proves maddening  as nothing is ever resolved  As he grows more uncertain of his fate  his personal life   including work at a bank and his relations with his landlady and a young woman who lives next door   becomes increasingly unpredictable  As K  tries to gain control  he succeeds only in accelerating his own excruciating downward spiral   The first discussion thread for it will be on April  st 
1,0,I am starting to realise my dad wont live forever  what are good places to go for a farther     son     trip My dads health has been declining for while  nothing serious yet but I would like to go on a trip with him while we both still can  I am open to just about anything  and would love to hear about some of your ideas or about farther son trips which you went on    Edit  wow I just woke up  I m absolutely blown away by how many of you have replied to this  I really appreciate it  I am reading everyone s comments but I can t reply to them all  Some of you have left very touching comments  stories  and suggestions which I will bare in mind   Here are some of my dads interests  outdoors stuff such as hiking  cycling or golf  he also loves to cook and enjoys food alot and he likes to travel  Ideally I think the duration of the trip would be anywhere between     weeks  Some of you have already given me some great ideas which I m looking into  I will continue to read your suggestions and story s  Thanks everyone 
2,0,What do you see on women s dating profiles that make you lose interest immediately Constructive criticism is good so I will start another thread for what women  can  do to better their profiles    https   www reddit com r AskMen comments b xrue what could women put in their dating profiles to  ut 
3,0,What could women put in their dating profiles to stand out more be more original show more personality Because constructive criticism is helpful   Follow up from this thread    https   www reddit com r AskMen comments b vx s what do you see on womens dating profiles that  utm 
4,0,What are some things on your mind that you can t talk about without being told  be a man  nan
5,0,What are the factors that makes a man s orgasm better than others he has had My GF was BLOWN AWAY to learn that men have orgasms of varying quality  What affects the quality of yours 
6,0,What s the worst you ve ever messed up nan
7,0,Any jobless unemployed men here  What are you doing to keep yourself from going insane nan
8,0,Men of Reddit  how and when did you realize that you needed professional help with your mental health nan
9,0,How to deal with emotional fatigue while dating Besides taking a break  I feel like I put in so much and girls I date expect so much that I just get exhausted  I m not talking about them expecting me to run errands for them or anything lame like that  I just mean the pressures of keeping in shape  keeping my apartment clean in case they come over  projecting confidence  etc   Edit  To clarify  I ve been experiencing a lot of disappointment and mixed messages from some women  but some hopeful signs with other women  at the same time  I have have had three to five women with potential in my life in the past month or so  A couple that I haven t met yet   I m not a player  and nothing has happened with most of them  but I m overwhelmed    Edit    I know as a guy you re SUPPOSED to do all these things  and I have no problem with them  I guess my issue is that I feel really JERKED AROUND by women lately  Set up for disappointment  frustration  etc 
10,0,How Is Going With the Flow Different I ve heard several people mention to  go with the flow  when it comes to dating  How exactly is this different than wanting to date someone and hoping it turns into a relationship  
11,0,Do you ever lurk a date s social media and end up getting your feelings hurt  How do you react when that happens For example  finding old ex pics or maybe seeing that they re talking to multiple guys  Do you ever stumble upon these things on social media and get hurt  How do you react when it happens 
12,0,Men who go to therapy  how has it changed your life Would you recommend it to everyone 
13,0,How do you leave your comfort zone I ve got a solid case on anxiety and low self esteem  and one advice that I m always getting is  leave your comfort zone   And I do that  from time to time  but I always end up running back to it   How do you leave your comfort zone  and how often  What are some tips you use to get you through it 
14,0,What are some good TV shows from the      s I m watching a documentary on Netflix titled   The     s   and the first   episodes are centered around how much tv has evolved since the start of the century  I grew up in the     s  so I mostly watched cartoons and American Idol lol  I would like to know what TV shows most of you watched during that time  
15,0,What are some disgustingly satisfying stuff you like to do For me it is squeezing blackheads until a tiny tip comes out and then pulling the entire  substance   out and looking at the pore hole 
16,0,What is the hardest choice you had to make and what was the outcome nan
17,0,Fathers of Reddit  What critical advice wisdom did those of us without Dads growing up miss out on nan
18,0,Top Gear or The Grand Tour   What s your favourite and why  nan
19,0,What plays played into your decision to have or not have kids I ve been thinking about this quite a bit lately  Overall I do want to have kids because I want to be a father and help raise someone to be a great individual the best that I can  Plus I enjoy how carefree kids can be and how much they enjoy life  But lately I ve begun to be very understanding of reasons people don t want to have kids  So what plays into your personal decision  whichever it is 
20,0,How do you stay interested in dating someone after getting to know them I ve seen a lot of advice for men is to ask any cute girl you meet out  or just as many as possible     My issue is that even when I m initially interested in someone  after a short conversation or just in general a short time after getting to know them  I lose all interest in dating them  This means that I never ask them out    I was wondering whether this is a somewhat common thing and how you stay interested in someone  I m unsure whether it s an issue with me or with the people I meet    I ve tried meeting people with common interests but even then I d just rather be alone after some time with with them    Edit    I m hetero romantic and asexual  In my case this means I m not motivated to have sex with anyone  and it s not something I d consider outside of a committed relationship     I m very introverted  so I find dating to be draining  especially with someone who I don t know well  This is why I prefer getting to know someone before I consider asking them out  Especially as in my age  at college  it s expected that you spend a lot of time with someone as soon as you start dating and I would find that very exhausting 
21,0,Men  what are the best ways your partner shows she respects you I realized I don t think I ve shown much respect to my husband and I d like to get better at this  but frankly  I m having a difficult time conceptualizing how to convey respect  What are the things your partners wives have done that have made you feel respected and appreciated 
22,0,Does your family background  birth country or upbringing cause to to feel out of place when you visit your parents country  How do the two countries gender norms differ  Do you find yourself adjusting to each country s standards I hear a sense of  i dont belong  ness from mixed people and people who were born in a country different to their parents  Im interested in hearing discussion about the questions i asked above and whatever else you deem important to include    For those of you that feel lost and like you dont belong in either country  how have you learned ro handle it  These questions can go towards mixed race people too 
23,0,Guys  what s the    thing that makes you happy that you re male For me  it s seeing incredibly long lines for women s bathrooms  Forget that noise 
24,0,What is your  she looks nothing like her pictures  story Maybe you met her online  Or a dating app     what s your story and how did you handle it 
25,0,What would you do for a thousand dollars  but not a hundred dollars nan
26,0,Men who have actually dated someone half your age  what are the pros and cons I m  of course  speaking to anyone over the age of     since  where I live  that s the first legal age you can sleep with someone half your age  
27,0,When was a time you found yourself in a  sexual situation  with a friend s mom nan
28,0,Why does everyone touch my beard without asking Everywhere I go  people will not stop touching my beard without asking   Doesn t matter if I m at the grocery store  a bar  or eating pizza on my lunch break   They ll start to braid my beard  reach over my shoulders to get a handful of beard  try to hide behind under it  just walk up and grab it  pet it  you name it   I get that you can t stop a stranger until they start doing something  but I am very curious if this happens to other guys out there  And does anyone know why people think this is okay to do 
29,0,He keeps saying  oh you   What does that mean Example   me  I added you on such and such website like you told me to c                        Him  Oh you  I ll look at it later   I m thinking it s in a positive light  But I can t shake the extremely vague feeling I get from it haha  Any help would be appreciated   Also btw were seeing each other  if that helps 
30,0,What foolish things do women do to get attention that they think men don t notice nan
31,0,My grandmmother re married  What do i call her new Husband Im    years old and about to meet my grandmothers new husband  My grandmother is my mothers mother  she s    years old   Should i call him by name to start off with 
32,0,What is the weirdest thing you ever masturbated to nan
33,0,When was the last time you were jealous For me it was today  where a girl I ve been talking to since November but only got gotten close with this week  texted me something that was meant or somebody else  She isn t my girlfriend  I don t even know if the other person is a guy or not but still my feelings were hurt  I was even passively aggressive to her afterwards and she called me out on it     amp  x   B   HBU   
34,0,What are the reasons that you decline holding hands with a girl nan
35,0,Based on the recent post  what are some things that make you wish you were a woman Because to be honest  I feel like there are way more pros to being a man than there are being a woman   
36,0,What s your  Her dad wrote my name on a shotgun shell in case I didn t have her home in time  story nan
37,0,What is the most wonderful thing a stranger girl has done for you nan
38,0,What are some telltale signs that girlfriend is mad at you Mine says  goodnight  instead of  night babe  
39,0,What kind of jewelry do you wear and why Personally I ve only ever worn a watch  I used to wear a bracelet but I ve since lost it  Is there even a point for a man to wear accessories  Is it even fashionable  Thoughts 
40,0,What are some of your favorite  tests of manliness  A few of our wives are out of town so we re having a  decathlon of manliness  while they re gone and need some help coming up with games challenges for individuals or teams  
41,0,Hi Neighbor  How about a nice  Gansett nan
42,0,Have you ever  taken things slow  with a woman you ve met who you had undeniable chemistry with  What was that like for you nan
43,0,Guys  how do you troll  annoy or tease your SO  I need ideasnan
44,0,How do you deal with a significant other that degrades you when in an argument I m kind of embarrassed to post this  but I m looking for a bit of help here  I ve been with my gf for about   months now and she has a history of getting a little too angry when an argument comes up  I won t get into detail  but she ll use my insecurities against me  speak about my past that I am not proud of  and degrade me to the point where my self confidence is taking a hit  I ve tried to talk to her about how to speak respectfully  and when the arguments arise and I see her getting angry I try to speak calmly and calm her down before moving forward  Nothing seems to work and I m hoping some of you can give me some advice 
45,0,Men  when you find yourself grinding your life away  how do you make friends I realized I spent the last three years of my life jumping between Highschool College Work   I already have tons of college credit  stable job as a Supervisor with tons of Job Packages like strong Healthcare options and Retirement Plans like    k with a strong backing   But looking back  I realized my  outside of work  friends are dwindling and getting busy in their lives  Plus I realized I kept my weeks busy almost all the time  Between Work and School  I mean like  am   am busy type hours   I am    and everyday feels like a slog and I should be happy  but it s a lonely existence and backbreaking at that   So r AskMen  how do you keep Social Relationships alive 
46,0,Men of reddit  how would you approach dating while living temporarily in another countryHow would you approach dating when living in another country for like     years  And maybe not knowing fully what happens after  If you date a girl  would you hold off on developing too much feelings for her  Or could you go all in regardless  So it s not just a sexual and or companionship thing  
47,0,What to look up when bored nan
48,0,Men  what dating advice could you offer to a female  I m on mobile so sorry about any grammar formatting issues   Okay so I ll start off with some background  When I was    years old I entered an abusive relationship with a    year old boy who I dated for almost   years  I finally broke up with him   years and    months later when I was    and even then he wasn t completely out of my life until I was about    and a half   With that being said  I m almost    and after receiving some therapy I am now finally taking an interest in dating again    But here is the dilemma  since entering that relationship until now   I really haven t really had many opportunities for interactions with men outside of minimal  platonic gestures    I ve gone on a few dates and I was either turned off by their immaturity  Lack of job  education  goals  ambitions  car  etc   Not that I expect someone my age to be established but I work full time  go to school full time  and live on my own  so I don t think it s unreasonable to expect that person to be on a similar path as me  Or they seem to be turned off by the fact that Im doing all of that  while they re  not  I d like to say  I have a quality personality and sense of humor  I m very kind and compassionate and I value having appropriate morals  And Id like to say I have features that Western society would define as attractive    So what I m trying to ask is how do I go about talking to men   Is it something I m doing wrong   I m not interested in dating apps and I work by myself so that limits me to meeting men at my community college social events    Is it weird for me to casually approach men   Suppose you were waiting for class and a female approached you and just started engaging in casual conversation  would that turn you off   What would you want that person to talk about  Are there independent men    What we re you looking for out of the female in terms of dating when you were in college  
49,0,What is the most useless pointless hobby you can think of When looking at new hobbies  people usually do cool stuff like rock climbing  making music  etc  However  I m looking for the dumbest possible hobbies to start  
50,0,How does one make platonic female friends       Does anyone have advice on how to make female friends   I m terrible at making female friends  I ve found that women tend to think I m hitting on them or being creepy and it depresses me   I honestly don t have ulterior motives  I just think it d be awesome to have a female friend that I could hang out with and hopefully support her in her life struggles   Any advice would be appreciated 
51,0,Men of Reddit  what s the best compliment you ve ever gotten from another man nan
52,0,What s an ongoing joke people poke fun at you about I m pretty airheaded at times so buddies would just shoot percentages of where my brain power is at haha  What about y all  
53,0,How can I make my guy friends feel more appreciated loved without being too upfront about it nan
54,0,Men of reddit  what about a women makes you think that she is a confident person nan
55,0,Men of reddit  what did you do for your first date nan
56,0,When was a time you were challenged to a fight  but the guy who challenged you backed down nan
57,0,Guys  have you ever been slut shamed  What happened nan
58,0,Dudes  what color of shoes would look best with a kinda blue suit Have to attend a formal event and I have no idea what kind of shoes would look good with a suit which is a mixture of blue and green more blue though  in shade   Please help me out lol
59,0,What is the weirdest thing you have ever forced yourself to think of in order to prevent finishing pre maturely during sex nan
60,0,Straight men of Reddit  what s the nicest compliment you ve ever received from another man nan
61,0,Have you ever had a woman try to train you  How  And how did you feel about it nan
62,0,Men  what are some hobbies interests you have that are generally associated with women I personally have been really into houseplants and starting to get into yoga  But none of the homies are into that so I can t converse with them about it 
63,0,Who is your worse enemy and why did it become that way My previous boss gave ultimatums and shifted responsibility to someone else constantly  Never had my blood boil so much before  I pledge next to be like her ever if I ever reach an admin position  
64,0,How do you open yourself to cry  How to undo drivers who block real scream cry nan
65,0,What does a perfect       day look like for you nan
66,0,How do you become comfortable being single nan
67,0,Hey guys  whats your opinion when visiting a nude beach  is privacy out the door and we women expected to be stared at nan
68,0,Guys who were terrible with women  what and how did you change that nan
69,0,Straight men of Reddit  how did your wife react when you proposed This is assuming she said yes
70,0,What is your favorite book nan
71,0,Have you ever pulled a Jussie Smollet on someone or a group  What did you do So have you ever lied to someone or a group about an incident to gain sympathy  How did it go  Did anyone find out 
72,0,What is the best place to find cool looking graphic tees nan
73,0,What s the lamest thing you ever did to get a girl to notice you   inspired by a similar r AskWomen thread There s a couple for me  they all involve the same girl  To start off  once we were in technology class talking about movies as a group  she mentioned that she loved Tenacious D  I had a class again with her after two periods that day  so I spent those classes watching the movie instead of paying attention just so when I saw her again I could play it off as if it was also my favorite movie  I also regularly texted this girl for the Social Studies homework even though I had done it a couple of days prior  I was a great student  but she got the impression I was lazy and mentally impaired for asking her the stupidest stuff 
74,0,What is your favorite hair style on a woman  Ex  pony tail  messy bun  half up  straight  etc nan
75,0,Men who attended their exes wedding  how did that work out for you nan
76,0,When was the last time you had a one night stand with some complete stranger nan
77,0,How do you guys like wearing suits For guys that do wear suits  what goes into your decision making in piecing together your dress and how do you like your fit   For guys that wear a suit every blood moon  when do you think is best occasion YOU wear a suit and what do you know about how to wear one    Bonus question  what do more men need to know about wearing a suit  What suit trends need to die out  make a return  or change for a better suit wearing world 
78,0,Guys of Reddit  Whats something someone said that was off the cuff but ended up being really devastating Something slight that ended up cutting really deep 
79,0,When I was young teen  I noticed that I was really attracted to the fact that my crush had really thick eyebrows and very dark arm hair for a girl  what was your first strange physical attraction and has it stuck nan
80,0,Married guys  what s the nicest thing you ve done for your in laws that scored you points nan
81,0,How do you keep the level of excitement of pursuing a woman after you have them Sometimes I feel like whenever I get what I want  the desire isn t what it was when I was chasing it
82,0,Fellas  what s y alls best excuse that always works when calling out  nan
83,0,What are you frequently do when you are in good mood nan
84,0,When you find yourself in the limbo of being good friends or in a relationship with someone  what do you do to help make your final decision nan
85,0,If you could set fire to something  what would you burn  nan
86,0,What quotes  mantras or phrases really helped you better yourself What are they  amp  how do they help    One of my main ones is  No man is free who cannot conquer himself   It s by Epictetus  The reason it is so powerful to me is because it made me realise that the only thing stopping you from being the man that you want to be are the negative habits mindsets people in your life  By truly facing up to them head on and overcoming them  you will be free  
87,0,Why shouldn t you remain friends with your ex nan
88,0,what do you want in bed asking for sience reaserch  really
89,0,Attractive men  when was a time you felt your attractiveness was actually a disadvantage in certain aspects of your life  What are they X Post from AW
90,0,What s your rock bottom story Need some inspiration on guys who made it out  Recently within the past month this is what s happened    dumped by GF  I was a toxic insecure asshole in the relationship and didn t realize my mistakes until it was far too late   proceeded to humiliate myself during breakup mode  bridge burned  anniversary of mom s death hit me like a ton of bricks  relationship with family deteriorating  grandfather died  flunking college  nearly lost my job as a result of all of this  As a result of this  I was hospitalized where the doctor said I had been experiencing two weeks  worth of panic attacks  I m exhausted and it feels like a giant chore just to accomplish day to day activities  This all hit super fast and I m trying to motivate myself to pull out of it  I m trying to limit my drinking and how many hours I spend in bed  Any advice or other personal stories are greatly appreciated   Edit  wow thanks a ton everyone for your support and stories  I feel like I m starting a whole new chapter in my life and am becoming a new man 
91,0,What are some expectations you should have when seeing dating someone who recently got out of a serious relationship nan
92,0,If you could say anything to your first love serious relationship  what would you say nan
93,0,What is something that society expect from you that you don t give a shit about it nan
94,0,What dog do you have  if you could which breed would you get for not yet owners  One of my dreams is to have my own flat and have a pug running around  or have a German Australian Shepherd   someday hope it comes true
95,0,If an unavailable woman you ve been crushing on compliments you  how does it affect you I ve    F  seen a lot of posts lately about how rarely men receive compliments  and it bums me the crap out  But I m curious how it works when there are complicated feelings there  It can happen to any of us  a coworker  friend  classmate  bartender  etc  with whom we get along exceptionally well and are attracted to  but is unfortunately taken   So if an unavailable woman you re into compliments you  does it make it harder for you to cope with your feelings and or maintain appropriate boundaries  Or are you able to take it as a straight forward compliment and nothing more 
96,0,How was your job search post college For that first  real  job  How did it go  Any tips when applying 
97,0,What can be done to not become old and bitter like the rest of y all nan
98,0,What are some nicknames you have for your SO nan
99,0,Men of reddit  What are some hobbies that lead to self improvement nan
100,0,What are the some of the great   line lyrics of a song that you have heard Mine         Yes they are sharing a drink they call loneliness       But it s better than drinking alone 
101,0,Where are you in your career  How did you get there nan
