,Subreddit,Title_Content
211,1,Where are your favorite high waisted bikini bottoms from I ve seen good ones on American eagle aerie other websites but there s so many different types that I m not sure which are best  
212,1,How do you make a long distance relationship work I m planning on studying in another country for   months and feel nervous  
213,1,What are you looking forward to this week nan
214,1,What are your productivity organization tips nan
215,1,How old were you when you stopped calling yourself a girl and started calling yourself a woman nan
216,1,What are your favorite places to shop for bikinis Ladies with larger boobs  what are your go to brands stores for buying comfortable  affordable bikinis that offer good support and padding 
217,1,How do you know if people around you think you have bad breath nan
218,1,What made you realize you fell in love with someone  What happened after nan
219,1,what s a good book you ve been reading nan
220,1,Your coworker tells you that they ve told their daughter   By wearing revealing clothing  you re asking to get raped   What do you say nan
221,1,How often do pretty girls get asked for number Just curious  as a pretty girl  do you use dating app  
222,1,How important is it to base your life on what others think of you  Why do you think this way  How  as in to what extent
223,1,I m in a music rut  Does anyone have good music recommendations nan
224,1,How often do you wash your pillows Not the cases  the actual pillows   I ve just learned you re supposed to  and I m wondering what most people do   What about comforters and duvets 
225,1,What s an experience where you ve been treated differently because of your appearance nan
226,1,What people do you have no interest in getting to know or befriend  not that you have anything against them  you re just not interested  nan
227,1,What is the differences between cheap vs expensive makeup  How do you make those decisions nan
228,1,What s your favorite Disney movie soundtrack nan
229,1,Why are all products that women need even for normal maintenance so ridiculously expensive as compared to those that men need Whether you talk of face creams  body creams  shampoos and conditioners  make up items from mascara to foundation to eye shadow  face or hair treatments  hair styling instruments  everything  Sometimes I hate that we need so many things just to keep up and each of them costs so much  I feel overwhelmed 
230,1,Dear woman of Reddit  how do you actually feel about cargo shorts nan
231,1,What size bed do you have  and is there anything unique about it   Such as a waterbed  Tempurpedic  etc nan
232,1,Ladies that were diagnosed with a serious mental disorder  what was your reaction and how did you cope What was the disorder of you don t mind sharing and how did events in your past make you realize you had a problem  Were you feeling hopeless or did you choose to see it positively 
233,1,What is your personal reason to want children Hi   if i may  i d like to ask whats your personal reason to want children   Thanks for sharing this personal insight  My best regards   HC
234,1,What tattoos do you have  How do you feel about them nan
235,1,Ladies who have donated their eggs What made you go through with it and how was your experience Thinking about doing it 
236,1,Does anyone else suffer from travel anxiety  If so how did you overcome it and any tips for travelling long flights etc nan
237,1,If you were ever stand offish to a friend for no good reason  because of personal insecurities  for example  how did you apologize for your behavior nan
238,1,Ladies  what is your job career I m looking to change jobs and wonder what s out that that I ve never considered     So what do you all do  And how do you like it  
239,1,How do you battle low self esteem  or how have you overcome it nan
240,1,How would you react if your SO got plastic surgery without notifying you beforehand nan
241,1,What do you think is the biggest expectation imposed on women in today s society nan
242,1,Ladies  what role model helped you develop into the woman you are today nan
243,1,What is your  if I get pregnant  contingency plan There are so many of us who try so hard to not get pregnant  but even with the best efforts sometimes life finds a way 
244,1,How was your experience moving out from your parents  conservative family  house nan
245,1,What s the quickest and easiest method of shaving your legs nan
246,1,What are you like when you are at your worst  nan
247,1,What s something that leaves a pleasant positive first impression on you nan
248,1,If you have a strong need for external validation attention  what things have you done to re balance I m sure everyone at some point has realised that to different degrees they are seeking external validation   compliments  laughs  attention  likes upvotes  etc    because let s be honest  it feels great  Social media seems to make it worse because it s so easy now when you re feeling alone to post something and get some instant validation in the form of likes  or worse   not  get any likes validation and then feel even worse    If you ve ever felt this was getting to be a problem or affect your happiness or ability to just be alone  what kind of things have you done to stop seeking external validation so much and be able to internally validate yourself 
249,1,What types of foods can a broke college student buy at the grocery store to eat for lunch between classes  without needing a refrigerator that can be kept in the car for a few hours until eaten nan
250,1,What are things you try to avoid in a partner that aren t dealbreakers Factors or qualities you would really prefer not to have in a partner  but you can deal with if they re otherwise right  basically  
251,1,What do you do when you can t stop crying  either crying continuously or starting again only minutes to hours after stopping  and or how do you manage the side effects of over crying  puffy eyes  headache  etc   nan
252,1,What is your favorite flower and why nan
253,1,How do Hollywood s depictions of giving birth differ from the real life experience nan
254,1,While out in public  a random guy says something along the lines of  hey  smile   How do you respond nan
255,1,What is your usual order at Chipotle I m pretty simple   tacos chicken  no beans  cheese  green salsa  lettuce   and white rice  But I am trying to get some new recommendations  
256,1,What s the dumbest thing you ever heard someone say nan
257,1,What s your favorite science fiction novel From r AskMen
258,1,Instead of caffeine  what are your more natural ways to have pep in the morning and get you going for the day nan
259,1,Professional women who have all aspects of their life relatively under control  How do you do it I rarely see these type of women but when I see them I always think  how do they do it     Quick image of what I m describing        Professional career driven woman who is on top of her work  organized  disciplined  working up the career ladder  commands respect  but is not overly aggressive  She is polite  well mannered  hard working  and always seems to have her manners under control   She may be starting a business or non profit on the side     Health  She has her health under control  She is rarely seen eating sweets  Drinks a lot of water  green juices  salads  and appears effortless about it as well  As if her habits have been carved in stone and nothing will undo it  And yet she can occasionally have a bite of a cookie and not seem to care about it much  She most likely does yoga  pilates  or some other form of exercise  She doesn t have the perfect body but she is healthy  at a good weight   and appears happy with who she is     Appearance  She always seems effortlessly fashionable in a subtle way  She knows exactly what to wear to everything  For her the attention is to the details  nothing is flashy  She also takes care of her skin  For an older woman like this  she is aging well and is comfortable and confident despite some wrinkles  Her clothes are always clean  ironed  well fitting  etc     Charm  This woman is incredibly charming  Going back to her manners  she always seems to know what to say to make other people comfortable  She has an amazing smile and warmness to her that attracts people to her     Relationships  This one is the most important because sometimes I see all of the above but this one is lacking  This woman has a fulfilling relationship with her partner and her friends  She can easily switch from office hardworking to relaxing and having fun  She takes care of the people she loves   She commands respect  Although often I see these type of women tend to be careful with letting new people into their lives  Which can make it hard to get to know them  especially if you re not as put together as they are  I m thinking they are very careful of the company they keep because of the saying   You are the people you spend the most time with      Hobbies Talents  They build themselves up and enjoy life  They tend to have really cool hobbies they don t talk a lot about but that require effort  It s never Netflix  Some hobbies I ve seen  creating a type of woven art and selling it  running a Networking club  environmentally friendly fashion and skin care  learning languages  etc    amp  x   B   Each year I  meet  maybe     of these women  I might  see  more but I can only see their appearance and not the rest  They re incredibly rare and something I aspire to    amp  x   B     How do these women do it  Do you know someone like this  How do you become more like this  What was your story becoming more like a well put together career woman      amp  x   B    Note  I know a lot of people may say that it might be smoke and mirrors  sure these women have difficulties like everyone else but what separates them is that they don t unravel and they keep pushing forward     amp  x   B    amp  x   B     Update  It looks like the comments range from   That s unrealistic  no woman is like that  it doesn t exist  its too strict          to       that me and     of my friends  its not that hard but its basic adulting  It s a normal Tuesday for majority of women         Anyone have thoughts on this contrast    
260,1,Do you ever feel like your significant other  settled  for you  If so  how you deal with it nan
261,1,Those who still see the future being endless amount of possibilities for you and possess a can do attitude as you age  what is your secret nan
262,1,What s something difficult that you ve been through that ended up making you a better person How did it make you a better person 
263,1,What s the nicest thing your partner has done to make you feel beautiful nan
264,1,Fellow motherless daughters  how do you spend Mother s Day nan
265,1,What has been your best investment in yourself nan
266,1,What is the most savage response to being catcalled you have ever seen or heard nan
267,1,Fit and non fit crowd  how many calories do you eat how often do you workout what do you weigh Yep  I m asking the question you re never supposed to ask women   how much do you weigh    More specifically  what are your eating habits  workout habits  age  height and weight  I frequent r xxfitness and love hearing about all their accomplishments but I am so curious what a more  accurate  representation of the population looks like as far as lifestyle habits    How are you currently eating  exercising  weighing  feeling  looking  etc  Is there anything you re working on as far as fitness goes  Are you eating this way to lose weight  gain muscle  maintain  etc  Is it working  Do you eat clean  count macros  eat all McDonald s  etc    Other option  you don t give a shit and think this question is dumb  that s cool too  Please feel free to let me know that lol    Edit  do you have a  happy  weight  And if so  what is it and what is your height    Obviously you can be happy at whatever weight but is there a certain range you feel naturally more confident in  
268,1,How long does your hair take to air dry nan
269,1,Women who were diagnosed and treated with iron deficient anemia  how did you feel before and after being treated nan
270,1,What are some fun party games to play with your family Like charades
271,1,What is the biggest stressor on your sex life Fitness  Time constraints  Attraction  Having a partner partners  I m curious what gets in the way for other women 
272,1,What would you put in a care package for your SO  nan
273,1,What are the best places to buy inexpensive swimwear nan
274,1,How should your partner behave around people who have done you wrong How should your partner react if a person who doesn t speak to you  speaks to them 
275,1,How old were you when you realized that the world was a dangerous place for women  and what happened to trigger that realization nan
276,1,Women who had delayed delivery   gt  mths   how was it and how long were you pregnant nan
277,1,Woman who have suffered from addiction  what is your story I m trying to open my own mind to other women s experiences   What started your addiction  Are they any societal stigmas and biases that you have experienced  How has it impacted your life 
278,1,What steps have you taken to love yourself nan
279,1,How have you found ways to spend time with your mother nan
280,1,How do you cheer yourself up when you re dealing with heartbreak My SO of roughly   years and I just fully ended our relationship this morning  I need ideas on how to make myself feel better 
281,1,Women who have sold photos of their feet or other parts of your body  hands  hair  etc  for men with fetishes  how did it work out for you nan
282,1,What does the opposite of turning you on nan
283,1,How do you get beach ready legs  ie how do you shave or prep your legs in order to reduce strawberry legs and ingrown hairs nan
284,1,How do you women remain professional and civilized to people you must see  in law s  collegues  etc  that you don t like How do you stay your attitude professional civilized when you have to see certain people  colleagues  bosses  acquantinaces  in law s  etc  that you don t like   Do you have a mantra or  
285,1, NSFW  How does having low sex drive or lack of interest with sex in general affected your relationship nan
286,1,What is something really popular now  but in   years time everyone will look back and be embarrassed by nan
287,1,What are your itchy scalp remedies nan
288,1,Ladies who have moved from the US Southeast to the US West  what was your experience like nan
289,1,What is your proudest achievement in life  Do you have hopes of ever replicating a similar success nan
290,1,Do you eat breakfast  Why or why not nan
291,1,How are you doing right now  Are you ok  Do you want to talk about it nan
292,1,What bodies part do you shave on the regular nan
293,1,If You Enjoyed The Person and The Relationship  Why Did You Break Up with Them nan
294,1,What concerns would you have when dating someone     years older younger than you nan
295,1,How do you find quality people whom you could see yourselves with in a healthy caring relationship with nan
296,1,Alternative apps to social media Looking for some interesting apps games to use on my phone rather than trawling through Instagram and Facebook 
297,1,What are your thoughts on dating bisexual people nan
298,1,When does time pass the fastest and slowest for you What do you enjoy and what bores you  
299,1,Why do you think misogynists exist I just wasted brain cells and overall health arguing with a few of them 
300,1,What is something that people tell you about yourself  that you wholeheartedly disagree with For example  I ve been told that I lack empathy  but I don t  I m just not good at showing it  even to my closest friends and family members 
301,1,What s your best insult that doesn t use a swear word nan
302,1,Single women over    who are introverted  how do you meet people nan
303,1,Which part of you are you most ashamed of AND which part of you are you proud of nan
304,1,How to be happy no matter what  nan
305,1,how do you accept your past nan
306,1,Ladies  how has tinder  bumble  etc worked out for you and whatever it is you were looking for Will be going on there soon  wanna know how it s worked for some  
307,1,When people say  women prefer dating bad boys   Which traits of  bad boy  are they referring to  nan
308,1,What s your favorite piece of foreshadowing in a television show or movie nan
309,1,Stoner chicks what s your go to snack when you got the munchies nan
310,1,What As Seen On TV products do you love nan
311,1,What does your exercise routine look like in a typical week Is exercise something you prioritise  How often do you exercise  
312,1,As a preteen  what do you wish your dads knew or did differently nan
313,1,What games do you like on Nintendo Switch I just bought one today  I got Super Mario Odyssey  Smash  and Stardew Valley 
314,1,What is a movie that you actually think is much better than the book  and why nan
315,1,Ladies who swore they d never fall for their best friend  what was the turning point for you nan
316,1,What advice of yours was ignored just  or mostly  because you re a woman Whether it lead to an  I told you so  ending or not  I m curious to know what specific advice you gave out was ignored because you re a woman  This is assuming you re sure it wouldn t have been ignored had a man said it in the same situation 
317,1,What is that intentions and actions of people  men and women  you see from a mile away nan
318,1,What are your favorite YouTube channels I never used to watch anything YouTube before except incidentally  but recently I found a painter I love who makes cute tutorial advice videos  It s the first time I ve subscribed to a YouTube channel  Now I m curious about what YouTube channels you all follow  on any topic of course   What are they like  Why do you like them 
319,1,Can t get out of the bed after a bad heartbreak  Do you have something to say or a story that will give me hope  nan
320,1,Seasoned cooks of AW  what are your cooking tips for a novice Trying to improve my kitchen skills 
321,1,We ve heard a lot about bachelor pads  What s in your dream bachelorette pad nan
322,1,How do you girls open pickle jars nan
323,1,What do you bring in to your relationships nan
324,1,What is the reason some women get horniest during their period This is not the case for me  but I f like to know why for those of you ladies that experience this 
325,1,How has your body changed after pregnancy nan
326,1,How have you dealt with the knowledge that an ex is still devastated over the end of your relationship when you re completely fine nan
327,1,What is something you wish you were asked more often nan
328,1,What s something that you re sure you re worse than most people at  Do you have an example of your incompetence nan
329,1,Have you ever tried to warn an ex s new gf about their bad behavior  If so  how did it turn out nan
330,1,What is a rude question that you have been asked way too often nan
331,1,How do you feel when you sleep with someone and they ghost you Women  how do you really feel when you sleep with someone and they ghost you after  When you hook up with someone or have  been talking  and even though it was good  they don t want to do it again  get to know you  or even really talk afterwards  What do you do to avoid this situation  
332,1,Have you ever had a supernatural or unexplainable experience  What happened nan
333,1,What are you afraid of most nan
334,1,If any of you have dyscalculia  and dyslexia what do you do for a living I m     and I work in the beauty industry and I m getting burn out from it   I m a cosmetologist  I m Thinking of switching careers but I feel like my learning disabilities limit me  So  what do you do  What qualifications  I have so many questions lol 
335,1,What s the max distance you set your online dating apps to Just curious since I met a girl that only does   mile  Do you set yours to             
336,1,When did you accept that you might not find a romantic partner When did you realize that you might not find someone to spend your life with  How did you feel about that  Did you do anything in particular to move forward as a single person  
337,1,Where was a place you lived for a long time  but it never felt like home nan
338,1,Ladies who have one night stands or sleep with someone on the first date  what factors go into deciding your house or theirs nan
339,1,What are the good comments you received about your body nan
340,1,What are your favorite random niche subreddits nan
341,1,What s a sexy way a man can take off his jacket or hoodie with zipper I m not talking about doing a strip tease in the bedroom  but about taking off the coat or jacket once you re inside or taking off a layer of clothing with a zipper outside because it s too hot  while on a date but also with friends  is there some kind of gesture or way of removing these outer layer of clothing that you find sexy 
342,1,What do you love the most about being an independent adult woman nan
343,1,How do you deal with yourself when you feel like a piece of shit nan
344,1,What do you do when you feel neglected by your partner nan
345,1,How did you hint your SO that you liked them Edit  How d it work out  
346,1,How would you describe the feeling of being loved by or in love with a SO nan
347,1,Women who make more money than their partners   how is the dynamic between you and your SO Whether the difference between your two incomes is only a few hundred or tens  or even hundreds  of thousands     How is the financial dynamic with your boyfriend husband girlfriend partner  Does it affect any other parts of your relationship     Especially   if your SO started out making more than you  and the you started making more than them  in addition to the above  what changed over time    
348,1,Why do you think drag queens are a much bigger phenomenon than drag kings nan
349,1,What are boundaries for a man and a women being friends when one of them is in a relationship nan
350,1,If you could swap bodies with a male friend  why them and what would you do nan
351,1,Has your SO talked to you about  letting yourself go   How did they go about it  What was your immediate reaction  What did you do about it afterwards  if anything at all nan
352,1,What are some annoying things your SO does  but because you like them so much  its adorable annoyingThe feeling when they do this  you re annoyed  but can t be completely mad at them because you like them so much 
353,1,If you were a  good witch   what would you  good curse  someone or yourself with and why nan
354,1,r askwomen who likes to cook  how did you started And what s your favourite dish to cook 
355,1,How did you know you were ready to start having children nan
356,1,Women of Reddit  why do you wear bras or why not nan
357,1,What is your opinion on rings on guys Like what kind do like  how many rings is too many  do they have to match another piece like a necklace or at least match clothing  etc  
358,1,How many therapists did you go to before finding the right one for you I was naive and thought the first one would be a perfect match   
359,1,Sexual object or sexual subject   what is the difference for you Hey    I m really disturbed by this question   How do you consider someone as a sexual object or a sexual subject   It could be as a man or a woman    What do you think of it  
360,1,What was your worst  lightswitch moment   where you realized you never loved someone What was your worst lightswitch moment where you realized that not only do you not love someone  but you never even loved them even for a moment   even if up until that moment you thought you did  
361,1,Which place would you go when you re feeling single in life and hoping to meet someone nan
362,1,At what age does it start to be weird being a virgin I m not too old nor do I want to hold on to my virginity  I m just curious  Any experience 
363,1,What is your story of how a mistake in sending an email caused a real mess nan
364,1,I ve seen so many horror stories of experiences with doctors  What s an experience you ve had where a doctor actually cared about your concerns as a woman nan
365,1,What is the best variety of apple and why nan
366,1,What website did you meet your partner on nan
367,1,What s the weirdest crush you ve ever had nan
368,1,What s the strangest place you have hair on nan
369,1,Can anyone tell me a short and funny story about their dating life  I m having a hard time with mine nan
370,1,What moment in your life motivated the greatest change nan
371,1,What was your worse heartbreak nan
372,1,What do you think the world would be like if digital photography wasn t invented nan
373,1,All the single women  how does it feel being around couples and if you feel bad how do you cope up nan
374,1,Ladies who once feared their SO was merely settling for them  what incident proved you wrong and put those fears to rest nan
375,1,What s the best thing you ve heard from someone romantically interested in you Guy or girl  flirt or confession  No need to be reciprocal  just something you really enjoyed hearing 
376,1,What makes you feel particularly feminine nan
377,1,What is the worst case of misogynistic hypocrisy you ve seen We all know that misogyny doesn t operate on logic  and the men who are most likely to call all women inherently irrational and emotional are the ones who lack logical thinking  another trait they think is inherently male   have short tempers  and get super defensive and emotionally reactive  What are some situations or conversations you ve experienced that showed this hypocrisy 
378,1,What does prolonged eye contact do to you nan
379,1,Where to recycle donate bras  All in great conditionnan
380,1,How can you tell when you ve developed a crush on someone nan
381,1,When do you know you re over your ex nan
382,1,what parts of your body are asymmetrical  does it cause any inconveniences nan
