,Subreddit,Title_Content
404,0,Men who had the  what happened to us   conversation with an ex  how did it go nan
405,0,How do you deal with loneliness I ve been trying to figure out a way to become comfortable enough with myself so that I don t rely on others for happiness  Is the simple yet not so easy fix just working on yourself until you re totally content without having constant support and attention from others  
406,0,How do you entertain yourself when wife is out for couple weeks My wife went to another city to see her parents for two weeks  The thing is I actually never lived by myself    amp  x   B   I can take care of myself  But I don t know how to entertain myself when I m alone  Of course first few days I enjoy solitude  But i m sure that for the second week I will crawl the wall out of boredom  I already invited friends for beer at Friday  also me and my sister will have movie marathon at Saturday  But I can t forcibly circle myself with people for whole two weeks    amp  x   B   So  guys who live all by themselves  what do you do at your free time  Videogames or watching movies does not really work  I usually do this with my wife and got used to her commenting    amp  x   B   Example of this problem   last time my wife went to  girls only  party for Saturday night I got horribly drunk at our kitchen chatting with some Italians from chatroulette and then suffered hangover whole Sunday  Not the best experience  Italians were nice tho 
407,0,Men  do you feel confident that you could kick your dad s ass  If not  what s holding you back nan
408,0,How do you get over someone who doesn t like you back when you see them regularly Long story time   About a year ago I was out at a bar and my friend and I pursued a couple girls  We talked  we re having a great time and getting a little drunk  Well as the night is going on it is clear who is with who  but the problem was I had plans to get picked up by a recent Tinder hookup to go fuck  My drunken mind decided that I was risking not getting laid by sticking it out with this girl at the bar  lets call her Kate  and dipped out    Well fast forward however the fuck long    weeks idk  My friend and the girl he was talking to hooked up and now they re dating and I m seeing them regularly  I felt bad about what I did to her friend  explained to her and apologized and blamed it on my drunken stupor  Didn t really see Kate often but always played it cool and continued joking around with her when she was around  Then one night my friend group is going out  she tags along  I m nervous  drink too much  and come off as clearly way to into her  Not saying anything  but straight ogling over her when she s talking to me  Pretty much blew my chance there  and not to mention that my friend s girlfriend ended up telling her what happened the night they first met  This was before I had told her about my feelings for her so can t really blame her  it s her best friend   Then about a month ago my friend s girlfriend told me that  Kate  had completely planned on hooking up with me  But between ditching her then and coming off a bit too strong I had kinda blown it    Well now Kate met up with us last week at a bar and I continued just being myself  making her laugh etc  She decides to come out with our group again this weekend  Friday night she has a blast  saying it s the hardest she s ever laughed  wants to be in the group  and genuinely likes going out with us  Saturday comes around  we all go out again  We re all drinking and talking  me and her in a lot of one on one convos  We re all teetering on the edge of too drunk and my friend s gf and Kate go up and start flirting with these two dudes friend s gf was mainly playing wingman here   In my mind it was probably just being drunk and flirty whatever  but also sucks to see when you still have feelings for someone  We all end up leaving  those guys not included  and go back to my friends to crash  That night we re sleeping at my friends and we end up staying up until about      watching weird youtube vids together and talking  A great night with someone I truly like spending time with and think is potentially the most beautiful girl I ve ever talked to   But I      respect her decision not to pursue things romantically with me because of what I did in the past  I made poor decisions in the moment and would probably not date me as well if the roles were reversed  But I also want this person to feel comfortable in our friend group and to continue to come out with us  I just don t want to have that jealousy building inside me when we go out and she talks to another guy or if she starts dating or talking about other guys in front of me   I ve been mainly working towards bettering myself as a person  lifting  dropping some weight  reading  just trying to keep busy  But it s something that is always in the back of my mind  I want it gone or at least to the point where I don t have this jealous pit in my stomach  Have you guys gotten over this before or experienced something similar   TL DR  Met a couple girls a year ago  I ditch to go hookup with someone else  friend starts dating one of them  flash forward a year and the girl I talked to wants to be in our group  She was into me  now seems like she probably isn t  but I m still into her  Need help getting over her so she doesn t feel uncomfortable 
409,0,How do you begin to appreciate being in nature while alone I m having somewhat of a existential crisis I suppose  I think I want to start doing outdoor activities by myself  especially in nature  Maybe bring a book  maybe start longboarding  Who knows    How do I appreciate being in natures presence  What else do you fellas recommend to really  find myself  
410,0,How do you find yourself I used to know myself  I feel like I ve lost myself and can t find him  I m    years old btw if that may have anything to do with it 
411,0,Men of reddit  What is your favorite sex position nan
412,0,What is your favorite  Chick Flick  nan
413,0,How bad is it if the girl you re interested in can t cook nan
414,0,How do you convince a guy out of suicidal thoughts If he refuses to go to a counselor 
415,0,How do you last during sex I ve just started having sex and it s sometimes very difficult for me to last  I ve tried looking some stuff and trying some but it never seems to work well  thanks for all your time  
416,0,How do you behave towards women you like when you are anxious or nervous towards them Hello people of r askmen   I want to know how do you act  behave towards a woman you like when you are feeling nervous or anxious    I m a female and i want to know  XD   Also TYIA everyone  lt  
417,0,What books have you read that have had a positive impact on your life nan
418,0,Men  how selective are you on dating apps nan
419,0,What is your advice to a fellow man who is coming out of a long term relationship      years  and at some point will be reentering the dating world Me      and my girlfriend      broke up last night after being together for     years  It was a mutual breakup  We both were starting to get unhappy together and felt like being together wasn t right anymore  I m curious what advice you all have for someone who will be getting back into dating after being in a long term relationship 
420,0,What is your dream car  Mine would be a Mercedes Benz      W     from       An absolute beast   https   en m wikipedia org wiki Mercedes Benz      Please ad an link to a picture or so  
421,0,What s the best advice you ve ever gotten nan
422,0,Have any of you struggled with friend groups that can t stand each other  How do you manage them So my band is playing our first kinda big show soon and there will be a party afterwards  Most of my friends will be there  and I just know I ll have to micro manage my way through the night  cause my   friend groups don t get along at all  They re all great on their own  but its an awkward mess whenever they mix  How do you gents handle such situations without distancing yourself from everyone  
423,0,What is your fantasy nan
424,0,What do you think about this  PE or I m normal Hey   So  long story short  I can last to       minutes easily but the FIRST  round  is always short  like     minutes I have no idea why but this is it  After the first intercourse I m good and I can last  do I have premature ejaculation   I thought about using Tramadol but not sure   Would reverse kegels help    
425,0,What best foods to Gain weight What best food to eat to gain weight  I thinking ING to eat patatoes everyday  but not sure what is better fried ore boiled  I have active life  and sometimes it s hard to find a time for eating    I don t do gym  
426,0,Guys  what are your stories of not pursuing someone you were romantically interested in nan
427,0,Do you ever like someone so much that they are all you can think about  How long does this phase usually last for you nan
428,0,Men who developed premature ejaculation for whatever reason  how did do you deal with it and how did it stop happening I m asking because I m kind of going though it right now  For whatever reason  and to be honest I really can t pinpoint which since a lot happened the past few months  I developed premature ejaculation  I did not have that issue before and didn t even notice it until my girlfriend pointed out to me  It made me feel like shit and lost my confident even in things that are unrelated to sex at all   I have to admit  my wonderful girlfriend stuck by my side through it all  she is the one who made me realize it s just a physical issue that can be solved with a little patience and some support       We re very communicative in terms of our sexual needs and wants  so I know she misses how things were before  which makes me feel worst sometimes  but mostly  I know she s by my side and I don t let it get to me as much as it used to  which also helped me to please her in other ways      I do have to add that in my case  it did came with a major change in my libido  going from     times a day to     times a week   I don t know if that s related  but I thought I should mention it too       That said  I only see slight improvement  I m not sure what the pace is supposed to be really  So I wanted to ask you  people who went through the same issue  or have more information about it       Thanks  
429,0,What job career do you actually enjoy nan
430,0,How would you feel about dating a female police officer  Or any kind of job that s male dominated  I have plans of becoming one but I m worried I won t be seen as feminine and men will be     intimidated I guess  
431,0,What is the best way to play with balls during foreplay  bjs and sex nan
432,0,How to deal with being lead on the broken heartedBasically a girl and I was talking for quite a while  according to her friends she rejected hookups with other guys because of me  called me cute and messaged me often  we went on a date  hugged and kissed  she texts me later that night saying she really wants to catch up again and then a week later when I ask to catch up she says she sees me as a friend and is talking to another guy    I feel broken    what do I do   Sorry if this is the wrong place to post  couldn t think of anywhere else 
433,0,If your objective dating stats  height  aesthetics  race  job  income   wealth  education background  are maybr average   above average but not top tier  is there any chance with a woman who is top tier and has access to really top tier guys  How do you figure out your  ceiling  nan
434,0,What is your favorite alcohol Men  Why do you drink   For fun  For a brief escape  To relax  Because you hate your marriage  Because it s a habit  Because it tastes good  Because you like the feeling  And what is your favorite alcohol  
435,0,What s something recently ish  that s been entertaining you It s been too wet outside for motorcycle joyrides  So for me it has been Minecraft right now  I know  what am I doing with my life  But hey  my friends are playing and they got turtles in the game now  What about you 
436,0,What s the dumbest thing you ever heard someone say Stolen from Askwomen 
437,0,What s the one insult you ll never forget It can be a super rude insult  but it can also be something really weird or confusing that just sticks with you for the rest of your life    amp  x   B   For example  this one day in sixth grade a girl in my class told me my  head is shaped like a Q tip   It didn t really hurt my feelings  but it was such a strange comment  I ll sure as hell remember that for as long as I live    amp  x   B   What s an insult you ve received that you ll never forget 
438,0,Shaving armpits  Why yes  Why no nan
439,0,How does your partner influence your diet exercise goals   Talk about your Diet and Exercise Goals     You are being invited to participate in a University of Texas at Austin research study about dietary and exercise goals  Your participation is completely voluntary and anonymous    amp  x   B     You are eligible to participate in this study if      You are    years of age or older    You are currently in a romantic relationship   You are currently cohabitating living with your romantic partner   Have actively pursued a dietary exercise related goal within the last   months   amp  x   B   Participation involves completing a    minute online survey  To participate  click on the link below to enter the online survey  if this doesn t work the link is also in the comments     https   utexas qualtrics com jfe form SV   Ahsw A rSu bV   https   utexas qualtrics com jfe form SV  Ahsw A rSu bV  
440,0,Straight men  do you feel that your partner openly discussing going to the toilet and or loudly belching  amp  farting is a turn off  If so  what would you do about it nan
441,0,How would you feel about a compliment on your online dating profile from someone too far away to actually date Sometimes I come across guys that seem interesting but also happen to live far away  and I feel like shooting them a  Hey  you seem cool and I just wanted to wish you good luck out there  type message  but I don t know if that would bother people       Thoughts 
442,0,Have you ever fallen out of love  How long did you wait to tell your SO about it In a relationship and I m scared my partner is falling out of love with me  I do t know how to tell or how to fix it
443,0,Any reddit guys out there waiting for the woman to ask them out  Why won t you take the initiative nan
444,0,What to do if my roommate took a shit in the dishwasher I ll preface this by apologizing for any formatting errors as I m on mobile   Long story short  my roommate  A  came home blackout drunk  A took a shit on the dishwasher  The dishwasher was open and a shit was where the detergent slot would be  I come downstairs to find roommate A blackout drunk on the floor next to the dishwasher  After making sure he was alive I called my other roommate  B  During the call  A ran the dishwasher with the shit in it   Currently my roommate A is passed out lifeless in his bed  Myself and roommate B are now wondering how to proceed further    Do I leave the shit in the dishwasher   What do I do  I know this seems hard to believe but please send advice on this situation  Thanks in advance 
445,0,How do you motivate yourself to keep on studying in school  to drag your ass to the gym and to do something productive other than sitting at the computer all day nan
446,0,What are the best things to say to a new partner who has performance anxiety in the bedroom nan
447,0,What are some fun  alternate satire news site other than The Onion nan
448,0,What s the TLDR description of your last relationship nan
449,0,What s your favorite science fiction novel nan
450,0,What s your favorite color nan
451,0,What would you think of a woman adding you on social media after meeting in a bar club It seems like the popular opinion on Reddit is that a forward woman is a good woman  but where would you draw the line between sexy forward and creepy clingy   Let s say you approached her when you were out  talked to her for some time  hit it off but nothing  happened  and she adds you a couple of days later  You never exchanged numbers but she could easily find you through information you had given her  
452,0,How do y all deal with sudden singleness Girlfriend of four months broke up with me out of nowhere Friday because she  isn t in a place for  our  relationship to move forward   I m struggling with the unexpectedness and inability to understand  across two conversations totalling about two hours she hasn t been able to articulate what this means  which part of me wants to conceed that maybe she s not lying and she s got shit she kept from me  but the rest of me thinks she just isn t into me anymore and is lying to  protect  me  herself     Anyway I have a history of anxiety and depression and don t want to go overboard with booze  but my normal activities  gym  gaming  etc   aren t really distracting me from the urge to obsessively try to understand  tho my therapy doggo is helping with lots of love and cuddles    I moved to a new city just before this relationship started  so I don t really have a local friend group to call on so I just kind of feel lonely and don t really have anybody to go out and about with  I gave myself yesterday to grieve  but now I want to make a plan to move forward and heal    So the question is  what do you do or what would you recommend after a breakup to jumpstart the healing process 
453,0,Going to my first professional massage tomorrow  what do I need to know My SO says I moan too much during her massages  shouldn t they be ready for that  I m not ashamed  I d rather just let it out    It ll be a female massage therapist  because that seems to matter 
454,0,So fellas    what age and how did you discover porn nan
455,0,Men of Reddit  When do you realise accept you ve caught all the feelings Bring on the mush you softies  
456,0,How many of you are growers and how many of you are showers I m trying to figure out the percentages for each  and am getting conflicting information  Are you a grower or a shower 
457,0,IYO  What s The Worst Piece of Advice Anyone s Ever Given You And why
458,0,Men with goatees  why don t you grow a real beard nan
459,0,How has your taste in partners developed over the years nan
460,0,How would you go about asking your significant other to be able to openly flirt chat with other people outside of the relationship without the sexual part nan
461,0,What s your dream job nan
462,0,When did you notice your bladder start getting weaker  I used to be able to drink a couple of pints of water right before bed  about   pm  and wake up    hours later before I needed the loo  now I m getting up a couple of times in the night   P S I did a urine test with my dr and the results came back saying I m ok    Edit  in my question I mean what age 
463,0,Have you not texted your girlfriend for days  As in radio silence  How many days  And why did you do that nan
464,0,Those of you with barely any friends social circle  how do you cope I ask because I m one of those guys   Its not that I dont want a regular social circle I just haven t had a good opportunity nor have I had one since high school     now    Funny thing is  It never bothered me until fairly recently  I go to work all day  socialize there a bit  come home and either go to gym  Netflix or just chill and go on social media  eat etc  on weekends I do random shit  browse internet  try new pastimes  sometimes potential hobbies that I can do solo even   But its like ive mastered the art of filling time doing my own thing  not socializing  and im sure that my social life peaked in  th grade   literally  I had   or   buddies then  Slowly through high school narrowed down to  ish at graduation and then in college never remotely clicked with anyone  Im      normal and I mean that in a literal sense  I kinda have a broish personality but I suck at being friend like with new people  Its like an invisible wall where I talk about the most surface level shit and then minimize social contact after that   As of this very moment I have one real lifelong bro but we barely hang out anymore  in fact probably not in at least   months  but when we do its all good   More than likely guys in my situation probably aren t in the dating scene either    but if you are   How do you date or do you  What are your reasons for it  Does it bother you  How do you cope  Is your partner ok or not ok with it  etc Lets talk about it 
465,0,What are good ways to not bore someone I m interested in through text She s said I m repetitive and it sucks ass that I never have interesting things to talk about
466,0,What the most embarrassing thing you have ejaculated on in nan
467,0,What is something they should teach in sex ed  but still don t nan
468,0,How do I impress my boyfriends dad Given the fact that his mom doesn t exactly like me  how should I make a good impression on his dad 
469,0,How would you feel if your girlfriend told you your close friend was attempting to sleep with her  Please explain I ll try to keep this short  I have a detailed version circulating on other ask subs    But  simple version of my question    would you rather know your close friend  roommate was actively trying to have sex with your girlfriend OR go on living your life thinking your friend is a stand up guy who has your best interests at heart   I m in a situation and I m torn  I don t know what would be more hurtful to him  They ve been friends for over    years   Ultimately  would you wish you never knew if you were the boyfriend in this circumstance and your girlfriend told you that   Would you be upset if your girlfriend didn t tell you about something like this  I d love to hear a male prospective and the reasoning behind why you would hypothetically rather or rather not know          I m the girlfriend  btw  Had to edit to remove confusion  My boyfriend is the one who doesnt know yet because I have not yet told him  Was looking to get prospective from you fine fellers before i go through with telling him  But thanks to your responses I think I know what I ll do         Thanks 
470,0,How do judge a text response from a girl Guys that have text a girl and she responds and you never text again  where did if all go wrong  What makes a good response or a bad response in your eyes 
471,0,What causes possessive behavior in men in relationshipsTrying to figure out what I m doing wrong in relationships  All men end up being very possessive with me and having unrealistic expectations when we re together  I ve known about several of my exes  previous relations through mutual friends and they re usually fairly decent   even the ones that end ugly don t ever end as ugly as mine do so I m starting to think that I m probably the problem    If it helps  I tend to be very submissive and understanding  At the same time  I m very level headed and supportive so I know when to take charge    Well  at least I thought I was  Help   
472,0,How can I be a nice guy but not a passive guy I recently saw a comment on one of the posts on this sub and asked myself if I was nice or passive  I then realized that all this time I thought that I was nice  I was actually passive the entire time  I am a    YO man  so I haven t developed all the emotional maturity yet  But I want to grow out of this and stop being passive without being mean  Any suggestions 
473,0,Guys who don t like dancing  what do you do at a club I hate dancing  absolutely can t stand it  I m not good at it  I don t enjoy it  and can t get myself to do it  Every now and then my fianc e and friends will want to go to one and I m forced to stand there awkwardly while they all dance and try to get me to do it too  What do you all do in this situation  
474,0,What are things other men are into but you aren t nan
475,0,Guys who went from wanting just hookups FWBs to desiring or being happy in committed relationships  what made you switch There is a tidbit of personal interest here  as I don t see myself ever really wanting a relationship   but it s mostly just curiosity  If you re a guy who s had a fair amount of hookups FWBs  what made you leave that behind 
476,0,How do you get your voice deeper I did some research and apparently the only way for my voice to get deeper was during puberty  I have already gone through most phases  late    y o   but my voice has been deepened by just a little bit  I was lazy video gamer at this time but only a year earlier i got my shit together and started working out  Is there a way for me to get my voice deeper or Am I stuck sounding like a    yo boy
477,0,How do you know to stop drinking before getting completely wasted when drinking alcohol It seems that whenever I start drinking at a party  there is a good chance that I will end up puking at some point because I don t realize I went over the limit until I m already sick and it s too late at that point to do anything about it   Some would say that you learn from experience  but that didn t work for me as I ve done this a lot   I kind of know my limit too  but most of the times I don t even think about it  Once I start drinking I don t really keep the count anymore   So how do you guys do it 
478,0,Guys who are happily married in a committed relationship  what obstacles did you and your SO have to overcome before getting to a happy stage in the relationship Edit  I d like to specify  by obstacles I meant like differences in personalities  different upbringings   how each person handles challenges  etc    There are times I feel like nothing could come between myself and my partner  other days I feel as though we are too similar  yet so different  It has nothing to do with how much I am in love with my SO  but rather how much I want to fast forward through the bad and get to the point where we laugh about the bad days    
479,0,What are you most ashamed of about your body nan
